{
  "$schema": "./schemas/tags.schema.json",
  "schema_version": "8.3",
  "description": "Canonical puzzle tag dictionary - maps any incoming tag to our 28 standard tags. This is the SINGLE SOURCE OF TRUTH for tag normalization. Frontend fetches this at runtime.",
  "last_updated": "2026-03-09",
  "changelog": [
    {
      "version": "8.3",
      "date": "2026-03-09",
      "author": "senseis-library-enrichment",
      "changes": "Added Sensei's Library cross-referenced aliases: ko gained superko/ko rule; seki gained impasse; ladder gained ladder breaker/shicho breaker; net gained net tesuji/geta tesuji; snapback gained snap/recapture; throw-in gained sacrifice inside/reduce eye space; capture-race gained liberty count/liberty counting/approach move; double-atari gained fork/two-way atari; eye-shape gained real eye/one eye/big eye/small eye/me; dead-shapes gained pyramid four/crossed five/five-point eye/four-point eye/three-point eye; liberty-shortage gained uchikaki/approach move shortage; connection gained kosumi connection/bamboo connection/tiger connection/nozoki connection; cutting gained crosscut/double cut/peep/nozoki; corner gained corner enclosure/shimari; sacrifice gained capturing sacrifice/sacrificial stone/give up to gain; shape gained empty triangle/bad shape/hane shape/ponnuki; tesuji gained atekomi/warikomi/descent/sagari/nose tesuji/hanezeki. Added corresponding alias_urls for all new aliases with distinct Sensei's Library pages."
    },
    {
      "version": "8.2",
      "date": "2026-03-02",
      "author": "chinese-alias-enrichment",
      "changes": "Added Chinese puzzle-book aliases from Baidu/101Weiqi catalogue (pounce, backward, levy, flutter, clip, mass kill, falling boots, robbery, hyperactive, etc.) and alias_urls for subconcepts missing Sensei's Library links (SqueezeTesuji, Placement, DoubleKo, Eye, FalseEye, ConnectAndDie, EyeVersusNoEyeCapturingRace, EyeVersusEyeCapturingRace, Oshitsubushi, JGroup, TripodGroupWithExtraLeg, CarpentersSquare). Added classic-tesuji alias cluster to tesuji tag (Hane, Kosumi, Keima, TigersMouth, OnePointJump, Wedge, MenChi, BaoChi, Sabaki, CranesNestTesuji, TwoStoneEdgeSqueeze, MouseStealingOil, TanukiNoHaraTsuzumi, twoheadeddragon, BlindSpot, UnderneathAttachment, StrikingAtTheWaistOfTheKeima)."
    },
    {
      "version": "8.1",
      "date": "unknown",
      "author": "unknown",
      "changes": "Added senseis_url per tag and alias_urls for aliases with distinct Sensei's Library pages. All URLs validated."
    },
    {
      "version": "8.0",
      "date": "unknown",
      "author": "unknown",
      "changes": "Renamed numericId to id, old id to slug (D31). Shifted tesuji IDs +10 (30-52), technique IDs +10 (60-82) (D30). Objectives unchanged (10-16)."
    },
    {
      "version": "7.0",
      "date": "unknown",
      "author": "unknown",
      "changes": "Added sparse numericId per tag (10-79 by category)."
    },
    {
      "version": "6.0",
      "date": "unknown",
      "author": "unknown",
      "changes": "Expanded taxonomy from 18 to 28 tags."
    },
    {
      "version": "5.0",
      "date": "unknown",
      "author": "unknown",
      "changes": "Renamed tags for universal recognition."
    }
  ],
  "tags": {
    "life-and-death": {
      "slug": "life-and-death",
      "id": 10,
      "name": "Life & Death",
      "category": "objective",
      "description": "Kill opponent's group or make your group live - the core tsumego objective",
      "aliases": ["killing", "kill", "death", "dead", "capture", "life-death", "tsumego", "l&d", "life and death", "killing problem", "death problem", "satsujin", "shikatsu", "basic life and death"],
      "senseis_url": "https://senseis.xmp.net/?LifeAndDeath",
      "alias_urls": {
        "tsumego": "https://senseis.xmp.net/?Tsumego"
      }
    },
    "living": {
      "slug": "living",
      "id": 14,
      "name": "Living",
      "category": "objective",
      "description": "Make your group live with two eyes",
      "aliases": ["life", "alive", "survive", "make life", "two eyes", "live", "ikiru", "katsu"],
      "senseis_url": "https://senseis.xmp.net/?TwoEyes"
    },
    "ko": {
      "slug": "ko",
      "id": 12,
      "name": "Ko",
      "category": "objective",
      "description": "Solution involves ko fight or ko threat",
      "aliases": ["ko fight", "ko threat", "kou", "kofight", "robbery", "serial robbery", "ko rule", "superko", "positional superko"],
      "senseis_url": "https://senseis.xmp.net/?Ko",
      "alias_urls": {
        "serial robbery": "https://senseis.xmp.net/?DoubleKo",
        "superko": "https://senseis.xmp.net/?Superko",
        "positional superko": "https://senseis.xmp.net/?Superko"
      }
    },
    "seki": {
      "slug": "seki",
      "id": 16,
      "name": "Seki",
      "category": "objective",
      "description": "Mutual life - neither side can kill",
      "aliases": ["mutual life", "dual life", "shared life", "hyperactive", "impasse"],
      "senseis_url": "https://senseis.xmp.net/?Seki"
    },
    "capture-race": {
      "slug": "capture-race",
      "id": 60,
      "name": "Capture Race",
      "category": "technique",
      "description": "Liberty race between groups - who captures first",
      "aliases": ["capturing-race", "capturing race", "semeai", "race", "liberty race", "liberties race", "fight", "eyes kill without eyes", "big eye kill small eye", "liberty count", "liberty counting", "approach move"],
      "senseis_url": "https://senseis.xmp.net/?CapturingRace",
      "alias_urls": {
        "semeai": "https://senseis.xmp.net/?Semeai",
        "eyes kill without eyes": "https://senseis.xmp.net/?EyeVersusNoEyeCapturingRace",
        "big eye kill small eye": "https://senseis.xmp.net/?EyeVersusEyeCapturingRace"
      }
    },
    "escape": {
      "slug": "escape",
      "id": 66,
      "name": "Escape",
      "category": "technique",
      "description": "Save a group by running or connecting out",
      "aliases": ["run", "flee", "break out", "running", "escaping", "runaway", "escape direction"],
      "senseis_url": "https://senseis.xmp.net/?Escape"
    },
    "snapback": {
      "slug": "snapback",
      "id": 30,
      "name": "Snapback",
      "category": "tesuji",
      "description": "Sacrifice stone(s) to immediately recapture more",
      "aliases": ["snap back", "snap-back", "uttegaeshi", "pounce", "backward", "snap", "recapture"],
      "senseis_url": "https://senseis.xmp.net/?Snapback"
    },
    "throw-in": {
      "slug": "throw-in",
      "id": 38,
      "name": "Throw-in",
      "category": "tesuji",
      "description": "Sacrifice inside opponent's shape to reduce liberties or create false eye",
      "aliases": ["throwin", "throw in", "horikomi", "sacrifice throw", "flutter", "sacrifice inside", "reduce eye space"],
      "senseis_url": "https://senseis.xmp.net/?ThrowIn"
    },
    "ladder": {
      "slug": "ladder",
      "id": 34,
      "name": "Ladder",
      "category": "tesuji",
      "description": "Diagonal staircase chase pattern",
      "aliases": ["shicho", "staircase", "chase", "levy", "ladder breaker", "shicho breaker", "ladder block"],
      "senseis_url": "https://senseis.xmp.net/?Ladder",
      "alias_urls": {
        "ladder breaker": "https://senseis.xmp.net/?LadderBreaker",
        "shicho breaker": "https://senseis.xmp.net/?LadderBreaker",
        "ladder block": "https://senseis.xmp.net/?LadderBreaker"
      }
    },
    "net": {
      "slug": "net",
      "id": 36,
      "name": "Net",
      "category": "tesuji",
      "description": "Loose surrounding capture (not tight like ladder)",
      "aliases": ["geta", "loose ladder", "loose net", "net capture", "flail", "flail and pinch", "net tesuji", "geta tesuji"],
      "senseis_url": "https://senseis.xmp.net/?Net"
    },
    "liberty-shortage": {
      "slug": "liberty-shortage",
      "id": 48,
      "name": "Liberty Shortage",
      "category": "tesuji",
      "description": "Exploit shortage of liberties to capture",
      "aliases": ["squeeze", "damezumari", "shortage of liberties", "squeezing", "tightening", "roll pack", "uchikaki", "approach move shortage"],
      "senseis_url": "https://senseis.xmp.net/?ShortageOfLiberties",
      "alias_urls": {
        "squeeze": "https://senseis.xmp.net/?SqueezeTesuji",
        "roll pack": "https://senseis.xmp.net/?SqueezeTesuji"
      }
    },
    "connect-and-die": {
      "slug": "connect-and-die",
      "id": 44,
      "name": "Connect & Die",
      "category": "tesuji",
      "description": "Opponent's stones connect but still get captured",
      "aliases": ["oiotoshi", "connect and die", "connection death", "chase and capture", "no return"],
      "senseis_url": "https://senseis.xmp.net/?Oiotoshi",
      "alias_urls": {
        "connect and die": "https://senseis.xmp.net/?ConnectAndDie"
      }
    },
    "under-the-stones": {
      "slug": "under-the-stones",
      "id": 46,
      "name": "Under the Stones",
      "category": "tesuji",
      "description": "Capture stones then play in the space they occupied",
      "aliases": ["ishi no shita", "under stones", "recapture space", "under the stone", "falling boots"],
      "senseis_url": "https://senseis.xmp.net/?UnderTheStones"
    },
    "double-atari": {
      "slug": "double-atari",
      "id": 32,
      "name": "Double Atari",
      "category": "tesuji",
      "description": "Simultaneous atari on two groups - forcing capture of at least one",
      "aliases": ["ryo-atari", "ryoatari", "double threat", "twin atari", "two atari", "doubles", "fork", "two-way atari"],
      "senseis_url": "https://senseis.xmp.net/?DoubleAtari"
    },
    "vital-point": {
      "slug": "vital-point",
      "id": 50,
      "name": "Vital Point",
      "category": "tesuji",
      "description": "Interior placement to reduce eyes or liberties",
      "aliases": ["placement", "oki", "interior placement", "inside play", "vital point placement", "dots"],